### ISSUE TITLE
Add an option to disable the periodic suspicious outgoing network activity

### ISSUE THREAD

**Issue by locture** [microsoft/vscode#154260]
I work in an environment in which no outgoing internet traffic is allowed. However, when I was running the vscode (version 1.68.1, with no extension and all the online service settings off) doing simple text editing, I repeatedly got alerts from IT that suspicious outgoing network activity was found from my machine.

I tested the behavior today on my home PC in a VM with a fresh installed Fedora 36 (verified with not any outgoing traffic) and the same online service settings being turned off with the settings json shown in below. 

`{
    "workbench.enableExperiments": false,
    "workbench.settings.enableNaturalLanguageSearch": false,
    "update.mode": "none",
    "update.showReleaseNotes": false,
    "json.schemaDownload.enable": false,
    "extensions.autoCheckUpdates": false,
    "extensions.autoUpdate": false,
    "settingsSync.keybindingsPerPlatform": false,
    "telemetry.telemetryLevel": "off",
    "npm.fetchOnlinePackageInfo": false,
    "typescript.disableAutomaticTypeAcquisition": true,
    "workbench.startupEditor": "none",
    "security.workspace.trust.banner": "never",
    "security.workspace.trust.emptyWindow": false,
    "security.workspace.trust.enabled": false,
    "security.workspace.trust.startupPrompt": "never",
    "extensions.ignoreRecommendations": true,
    "workbench.preferredLightColorTheme": "Default Dark+",
}`

And monitored the outgoing traffic with tcpdump. From what I captured, vscode periodically generates an suspicious outgoing network connection to the ip address 152.199.4.33. A part of the tcpdump logs are shown in below.

`22:47:19.142214 IP localhost.51548 > 152.199.4.33.https: Flags [S], seq 3401176550, win 64240, options [mss 1460,sackOK,TS val 1739951295 ecr 0,nop,wscale 7], length 0
22:47:19.169397 IP 152.199.4.33.https > localhost.51548: Flags [S.], seq 2534177140, ack 3401176551, win 65535, options [mss 1460,sackOK,TS val 1551772300 ecr 1739951295,nop,wscale 9], length 0
22:47:19.169449 IP localhost.51548 > 152.199.4.33.https: Flags [.], ack 1, win 502, options [nop,nop,TS val 1739951323 ecr 1551772300], length 0
22:47:19.169719 IP localhost.51548 > 152.199.4.33.https: Flags [P.], seq 1:518, ack 1, win 502, options [nop,nop,TS val 1739951323 ecr 1551772300], length 517
22:47:19.187331 IP 152.199.4.33.https > localhost.51548: Flags [.], ack 518, win 131, options [nop,nop,TS val 1551772322 ecr 1739951323], length 0
22:47:19.188511 IP 152.199.4.33.https > localhost.51548: Flags [P.], seq 1:100, ack 518, win 131, options [nop,nop,TS val 1551772322 ecr 1739951323], length 99
22:47:19.188523 IP localhost.51548 > 152.199.4.33.https: Flags [.], ack 100, win 502, options [nop,nop,TS val 1739951342 ecr 1551772322], length 0`

I did not find any information or document related to this suspicious behavior during a brief web search. There is not any known method to turn the behavior off, as the periodic connection persists even when every internet related setting has already been set to false. Generating such suspicious connection and uncontrollable network traffic without user consent is annoying when working in a limited environment, and can even lead to unexpected costs when working under a metered connection. It is also considered as a harm to user privacy and a potential safety issue.

Thus I would like to submit a feature request here, that a setting should be provided to turn off this suspicious connection and free the users from the unexpected periodic network activity. The software should be able to stay silent in an "offline mode" while all the stuff which generates traffic thru internet should be controllable by the user and require user consent.

Thanks for your time.

Loc

**Comment by VSCodeTriageBot** [comment]
Thanks for creating this issue! We figured it's covering the same as another one we already have. Thus, we closed this one as a duplicate. You can search for [similar existing issues](https://github.com/microsoft/vscode/issues?utf8=%E2%9C%93&q=is%3Aopen+is%3Aissue+label%3A%22triage-needed%22). See also our [issue reporting guidelines](https://aka.ms/vscodeissuereporting).

Happy Coding!
